{
  "$schema": "https://skyrising.github.io/mc-versions/schemas/version.json",
  "client": true,
  "downloads": {
    "client": {
      "sha1": "ff70a84c9cdc99a866c4b06410ec46f541dcf988",
      "size": 17234567,
      "url": "https://launcher.mojang.com/v1/objects/ff70a84c9cdc99a866c4b06410ec46f541dcf988/client.jar"
    },
    "client_mappings": {
      "sha1": "6f20bbe4218c895f621aeb60e9874674891a21b5",
      "size": 5425299,
      "url": "https://launcher.mojang.com/v1/objects/6f20bbe4218c895f621aeb60e9874674891a21b5/client.txt"
    },
    "server": {
      "sha1": "0393774fb1f9db8288a56dbbcf45022b71f7939f",
      "size": 37554531,
      "url": "https://launcher.mojang.com/v1/objects/0393774fb1f9db8288a56dbbcf45022b71f7939f/server.jar"
    },
    "server_mappings": {
      "sha1": "940a087b56105319bd32960a8241c68c55cf9aea",
      "size": 4163637,
      "url": "https://launcher.mojang.com/v1/objects/940a087b56105319bd32960a8241c68c55cf9aea/server.txt"
    }
  },
  "id": "20w20b",
  "libraries": [
    "com.google.code.gson:gson:2.8.0",
    "com.google.guava:guava:21.0",
    "com.ibm.icu:icu4j:66.1",
    "com.mojang:authlib:1.6.25",
    "com.mojang:brigadier:1.0.17",
    "com.mojang:datafixerupper:2.0.24",
    "com.mojang:javabridge:1.0.22",
    "com.mojang:patchy:1.3.9",
    "com.mojang:text2speech:1.11.3",
    "commons-codec:commons-codec:1.10",
    "commons-io:commons-io:2.5",
    "commons-logging:commons-logging:1.1.3",
    "io.netty:netty-all:4.1.25.Final",
    "it.unimi.dsi:fastutil:8.2.1",
    "net.java.dev.jna:jna:4.4.0",
    "net.java.dev.jna:platform:3.4.0",
    "net.java.jinput:jinput:2.0.5",
    "net.java.jutils:jutils:1.0.0",
    "net.sf.jopt-simple:jopt-simple:5.0.3",
    "org.apache.commons:commons-compress:1.8.1",
    "org.apache.commons:commons-lang3:3.5",
    "org.apache.httpcomponents:httpclient:4.3.3",
    "org.apache.httpcomponents:httpcore:4.3.2",
    "org.apache.logging.log4j:log4j-api:2.8.1",
    "org.apache.logging.log4j:log4j-core:2.8.1",
    "org.lwjgl:lwjgl-glfw:3.2.2",
    "org.lwjgl:lwjgl-jemalloc:3.2.2",
    "org.lwjgl:lwjgl-openal:3.2.2",
    "org.lwjgl:lwjgl-opengl:3.2.2",
    "org.lwjgl:lwjgl-stb:3.2.2",
    "org.lwjgl:lwjgl-tinyfd:3.2.2",
    "org.lwjgl:lwjgl:3.2.2",
    "oshi-project:oshi-core:1.1"
  ],
  "manifests": [
    {
      "assetHash": "28680197f74e5e1d55054f6a63509c8298d428f9",
      "assetIndex": "1.16",
      "downloads": "9c7264175371f889e9fd1acdb91d5fcc1d7628e7",
      "downloadsId": 1,
      "hash": "5480903121430c43adb7a416275a16bdf4f892ad",
      "lastModified": "2022-02-25T13:39:20+00:00",
      "time": "2020-05-14T08:16:26+00:00",
      "type": "snapshot",
      "url": "https://skyrising.github.io/mc-versions/manifest/5/4/80903121430c43adb7a416275a16bdf4f892ad/20w20b.json"
    },
    {
      "assetHash": "738b17ea266089b5e384791eb5a2cf1fafe109b6",
      "assetIndex": "1.16",
      "downloads": "9c7264175371f889e9fd1acdb91d5fcc1d7628e7",
      "downloadsId": 1,
      "hash": "63010786652e87c08a451081596506bd2e8f4db8",
      "lastModified": "2021-12-15T15:52:22+00:00",
      "time": "2020-05-14T08:16:26+00:00",
      "type": "snapshot",
      "url": "https://skyrising.github.io/mc-versions/manifest/6/3/010786652e87c08a451081596506bd2e8f4db8/20w20b.json"
    },
    {
      "assetHash": "738b17ea266089b5e384791eb5a2cf1fafe109b6",
      "assetIndex": "1.16",
      "downloads": "9c7264175371f889e9fd1acdb91d5fcc1d7628e7",
      "downloadsId": 1,
      "hash": "8fc732503c1271083b3c4023cfa0c05c6cf62180",
      "lastModified": "2021-12-10T02:58:42+00:00",
      "time": "2020-05-14T08:16:26+00:00",
      "type": "snapshot",
      "url": "https://skyrising.github.io/mc-versions/manifest/8/f/c732503c1271083b3c4023cfa0c05c6cf62180/20w20b.json"
    },
    {
      "assetHash": "738b17ea266089b5e384791eb5a2cf1fafe109b6",
      "assetIndex": "1.16",
      "downloads": "9c7264175371f889e9fd1acdb91d5fcc1d7628e7",
      "downloadsId": 1,
      "hash": "f77ca0d2199f33b88d71ec1f87734e3bec674616",
      "lastModified": "2021-11-30T09:49:06+00:00",
      "time": "2020-05-14T08:16:26+00:00",
      "type": "snapshot",
      "url": "https://skyrising.github.io/mc-versions/manifest/f/7/7ca0d2199f33b88d71ec1f87734e3bec674616/20w20b.json"
    },
    {
      "assetHash": "ad75fb46ff5c89aa5f9c90e12481e963854f9a6e",
      "assetIndex": "1.16",
      "downloads": "9c7264175371f889e9fd1acdb91d5fcc1d7628e7",
      "downloadsId": 1,
      "hash": "562a6ab86f1668c091b27b633be6bee018f60d31",
      "lastModified": "2021-07-07T13:56:18+00:00",
      "time": "2020-05-14T08:16:26+00:00",
      "type": "snapshot",
      "url": "https://skyrising.github.io/mc-versions/manifest/5/6/2a6ab86f1668c091b27b633be6bee018f60d31/20w20b.json"
    },
    {
      "assetHash": "ad75fb46ff5c89aa5f9c90e12481e963854f9a6e",
      "assetIndex": "1.16",
      "downloads": "9c7264175371f889e9fd1acdb91d5fcc1d7628e7",
      "downloadsId": 1,
      "hash": "c37c6bb50811868714edfd36adfaf6fcbd3fe86c",
      "lastModified": "2021-06-29T15:20:37+00:00",
      "time": "2020-05-14T08:16:26+00:00",
      "type": "snapshot",
      "url": "https://skyrising.github.io/mc-versions/manifest/c/3/7c6bb50811868714edfd36adfaf6fcbd3fe86c/20w20b.json"
    },
    {
      "assetHash": "3a5d110a6ab102c7083bae4296d2de4b8fcf92eb",
      "assetIndex": "1.16",
      "downloads": "9c7264175371f889e9fd1acdb91d5fcc1d7628e7",
      "downloadsId": 1,
      "hash": "4d234e2814357344cd6c895abfdd8c88ab8031d2",
      "lastModified": "2021-01-13T14:12:35+00:00",
      "time": "2020-05-14T08:16:26+00:00",
      "type": "snapshot",
      "url": "https://skyrising.github.io/mc-versions/manifest/4/d/234e2814357344cd6c895abfdd8c88ab8031d2/20w20b.json"
    },
    {
      "assetHash": "f8e11ca03b475dd655755b945334c7a0ac2c3b43",
      "assetIndex": "1.16",
      "downloads": "9c7264175371f889e9fd1acdb91d5fcc1d7628e7",
      "downloadsId": 1,
      "hash": "ed56963a8838431b77f653eb0e3e4875b195e29b",
      "lastModified": "2020-12-02T16:57:25+00:00",
      "time": "2020-05-14T08:16:26+00:00",
      "type": "snapshot",
      "url": "https://skyrising.github.io/mc-versions/manifest/e/d/56963a8838431b77f653eb0e3e4875b195e29b/20w20b.json"
    },
    {
      "assetHash": "6aeb80664ca8c3c1e114f9ee428bb0bd7d29b1ab",
      "assetIndex": "1.16",
      "downloads": "9c7264175371f889e9fd1acdb91d5fcc1d7628e7",
      "downloadsId": 1,
      "hash": "76258d97b9a45d708e3891166dcc7f5667c9eedf",
      "lastModified": "2020-11-02T16:33:52+00:00",
      "time": "2020-05-14T08:16:26+00:00",
      "type": "snapshot",
      "url": "https://skyrising.github.io/mc-versions/manifest/7/6/258d97b9a45d708e3891166dcc7f5667c9eedf/20w20b.json"
    }
  ],
  "next": [
    "20w21a"
  ],
  "normalizedVersion": "1.16.0-alpha.20.20.b",
  "previous": [
    "20w20a"
  ],
  "protocol": {
    "type": "netty",
    "version": 717
  },
  "releaseTarget": "1.16",
  "releaseTime": "2020-05-14T08:16:26+00:00",
  "server": true,
  "sharedMappings": true,
  "world": {
    "format": "anvil",
    "version": 2537
  }
}