{
  "$schema": "https://skyrising.github.io/mc-versions/schemas/version.json",
  "client": true,
  "downloads": {
    "client": {
      "sha1": "417fe811581f045d4f5de0381b08cd7dc3744c41",
      "size": 9250850,
      "url": "https://launcher.mojang.com/v1/objects/417fe811581f045d4f5de0381b08cd7dc3744c41/client.jar"
    },
    "server": {
      "sha1": "df13c6cbf5fc735896b22f56b1f8940dd11a3b5f",
      "size": 9695321,
      "url": "https://launcher.mojang.com/v1/objects/df13c6cbf5fc735896b22f56b1f8940dd11a3b5f/server.jar"
    }
  },
  "id": "16w39c",
  "libraries": [
    "com.google.code.gson:gson:2.2.4",
    "com.google.guava:guava:17.0",
    "com.ibm.icu:icu4j-core-mojang:51.2",
    "com.mojang:authlib:1.5.24",
    "com.mojang:netty:1.8.8",
    "com.mojang:realms:1.9.3",
    "com.paulscode:codecjorbis:20101023",
    "com.paulscode:codecwav:20101023",
    "com.paulscode:libraryjavasound:20101123",
    "com.paulscode:librarylwjglopenal:20100824",
    "com.paulscode:soundsystem:20120107",
    "commons-codec:commons-codec:1.9",
    "commons-io:commons-io:2.4",
    "commons-logging:commons-logging:1.1.3",
    "io.netty:netty-all:4.0.23.Final",
    "it.unimi.dsi:fastutil:7.0.12_mojang",
    "net.java.dev.jna:jna:3.4.0",
    "net.java.dev.jna:platform:3.4.0",
    "net.java.jinput:jinput-platform:2.0.5",
    "net.java.jinput:jinput:2.0.5",
    "net.java.jutils:jutils:1.0.0",
    "net.sf.jopt-simple:jopt-simple:4.6",
    "org.apache.commons:commons-compress:1.8.1",
    "org.apache.commons:commons-lang3:3.3.2",
    "org.apache.httpcomponents:httpclient:4.3.3",
    "org.apache.httpcomponents:httpcore:4.3.2",
    "org.apache.logging.log4j:log4j-api:2.0-beta9",
    "org.apache.logging.log4j:log4j-core:2.0-beta9",
    "org.lwjgl.lwjgl:lwjgl-platform:2.9.4-nightly-20150209",
    "org.lwjgl.lwjgl:lwjgl:2.9.4-nightly-20150209",
    "org.lwjgl.lwjgl:lwjgl_util:2.9.4-nightly-20150209",
    "oshi-project:oshi-core:1.1"
  ],
  "manifests": [
    {
      "assetHash": "4fa7f939c7e9902e6c674ad1d00358f8c08d7b8e",
      "assetIndex": "1.11",
      "downloads": "761fd3555dd8fc736da39c713e08d7906a18819b",
      "downloadsId": 1,
      "hash": "cb6d954c591717c457863f84b004246778a51ce7",
      "lastModified": "2021-12-15T15:57:27+00:00",
      "time": "2016-09-30T14:11:48+00:00",
      "type": "snapshot",
      "url": "https://skyrising.github.io/mc-versions/manifest/c/b/6d954c591717c457863f84b004246778a51ce7/16w39c.json"
    },
    {
      "assetHash": "4fa7f939c7e9902e6c674ad1d00358f8c08d7b8e",
      "assetIndex": "1.11",
      "downloads": "761fd3555dd8fc736da39c713e08d7906a18819b",
      "downloadsId": 1,
      "hash": "a4d4887ea35bc35e35037a4a74a389e70f3f4f5b",
      "lastModified": "2021-07-07T14:00:58+00:00",
      "time": "2016-09-30T14:11:48+00:00",
      "type": "snapshot",
      "url": "https://skyrising.github.io/mc-versions/manifest/a/4/d4887ea35bc35e35037a4a74a389e70f3f4f5b/16w39c.json"
    },
    {
      "assetHash": "4fa7f939c7e9902e6c674ad1d00358f8c08d7b8e",
      "assetIndex": "1.11",
      "downloads": "761fd3555dd8fc736da39c713e08d7906a18819b",
      "downloadsId": 1,
      "hash": "b6072818f323b5e9ea51f1e501880a9e88025144",
      "lastModified": "2018-08-29T13:00:00+00:00",
      "time": "2016-09-30T14:11:48+00:00",
      "type": "snapshot",
      "url": "https://skyrising.github.io/mc-versions/manifest/b/6/072818f323b5e9ea51f1e501880a9e88025144/16w39c.json"
    }
  ],
  "next": [
    "16w40a"
  ],
  "normalizedVersion": "1.11.0-alpha.16.39.c",
  "previous": [
    "16w39b"
  ],
  "protocol": {
    "type": "netty",
    "version": 309
  },
  "releaseTarget": "1.11",
  "releaseTime": "2016-09-30T14:11:48+00:00",
  "server": true,
  "sharedMappings": true,
  "world": {
    "format": "anvil",
    "version": 812
  }
}