{
  "$schema": "https://skyrising.github.io/mc-versions/schemas/version.json",
  "client": true,
  "downloads": {
    "client": {
      "sha1": "3a0d41e74a18e2c26498a918724ff39d62af329c",
      "size": 7590320,
      "url": "https://launcher.mojang.com/v1/objects/3a0d41e74a18e2c26498a918724ff39d62af329c/client.jar"
    },
    "server": {
      "sha1": "ee24a6e63b007b9ec97a591afe1a29a6bbbfe143",
      "size": 10328935,
      "url": "https://launcher.mojang.com/v1/objects/ee24a6e63b007b9ec97a591afe1a29a6bbbfe143/server.jar"
    },
    "windows_server": {
      "sha1": "fb80a59b1159f2a57edc0f837846253f89fdb379",
      "size": 10723175,
      "url": "https://launcher.mojang.com/v1/objects/fb80a59b1159f2a57edc0f837846253f89fdb379/windows_server.exe"
    }
  },
  "id": "14w30b",
  "libraries": [
    "com.google.code.gson:gson:2.2.4",
    "com.google.guava:guava:17.0",
    "com.ibm.icu:icu4j-core-mojang:51.2",
    "com.mojang:authlib:1.5.16",
    "com.mojang:netty:1.8.8",
    "com.mojang:realms:1.5",
    "com.paulscode:codecjorbis:20101023",
    "com.paulscode:codecwav:20101023",
    "com.paulscode:libraryjavasound:20101123",
    "com.paulscode:librarylwjglopenal:20100824",
    "com.paulscode:soundsystem:20120107",
    "commons-codec:commons-codec:1.9",
    "commons-io:commons-io:2.4",
    "commons-logging:commons-logging:1.1.3",
    "io.netty:netty-all:4.0.15.Final",
    "java3d:vecmath:1.5.2",
    "net.java.jinput:jinput-platform:2.0.5",
    "net.java.jinput:jinput:2.0.5",
    "net.java.jutils:jutils:1.0.0",
    "net.sf.jopt-simple:jopt-simple:4.6",
    "net.sf.trove4j:trove4j:3.0.3",
    "org.apache.commons:commons-compress:1.8.1",
    "org.apache.commons:commons-lang3:3.3.2",
    "org.apache.httpcomponents:httpclient:4.3.3",
    "org.apache.httpcomponents:httpcore:4.3.2",
    "org.apache.logging.log4j:log4j-api:2.0-beta9",
    "org.apache.logging.log4j:log4j-core:2.0-beta9",
    "org.lwjgl.lwjgl:lwjgl-platform:2.9.1",
    "org.lwjgl.lwjgl:lwjgl:2.9.1",
    "org.lwjgl.lwjgl:lwjgl_util:2.9.1",
    "tv.twitch:twitch-platform:6.5",
    "tv.twitch:twitch:6.5"
  ],
  "manifests": [
    {
      "assetHash": "32ff354a3be1c4dd83027111e6d79ee4d701d2c0",
      "assetIndex": "14w25a",
      "downloads": "4b2b131b070e094bc5e63e09d925cdcf4e264210",
      "downloadsId": 1,
      "hash": "6cb8e867a0ce10649fe22a22f7ecaad42fd33383",
      "lastModified": "2021-12-15T16:00:22+00:00",
      "time": "2014-07-23T15:03:03+00:00",
      "type": "snapshot",
      "url": "https://skyrising.github.io/mc-versions/manifest/6/c/b8e867a0ce10649fe22a22f7ecaad42fd33383/14w30b.json"
    },
    {
      "assetHash": "32ff354a3be1c4dd83027111e6d79ee4d701d2c0",
      "assetIndex": "14w25a",
      "downloads": "4b2b131b070e094bc5e63e09d925cdcf4e264210",
      "downloadsId": 1,
      "hash": "447b5f4d11bb57230a8f33aa5b288b964a9daa2b",
      "lastModified": "2021-07-07T14:03:39+00:00",
      "time": "2014-07-23T15:03:03+00:00",
      "type": "snapshot",
      "url": "https://skyrising.github.io/mc-versions/manifest/4/4/7b5f4d11bb57230a8f33aa5b288b964a9daa2b/14w30b.json"
    },
    {
      "assetHash": "32ff354a3be1c4dd83027111e6d79ee4d701d2c0",
      "assetIndex": "14w25a",
      "downloads": "4b2b131b070e094bc5e63e09d925cdcf4e264210",
      "downloadsId": 1,
      "hash": "57bcfcbdd1b88e8bf9acdad43e866ee56be0a73d",
      "lastModified": "2018-08-29T13:01:49+00:00",
      "time": "2014-07-23T15:03:03+00:00",
      "type": "snapshot",
      "url": "https://skyrising.github.io/mc-versions/manifest/5/7/bcfcbdd1b88e8bf9acdad43e866ee56be0a73d/14w30b.json"
    }
  ],
  "next": [
    "14w30c"
  ],
  "normalizedVersion": "1.8.0-alpha.14.30.b",
  "previous": [
    "14w30a"
  ],
  "protocol": {
    "type": "netty",
    "version": 30
  },
  "releaseTarget": "1.8",
  "releaseTime": "2014-07-23T15:03:03+00:00",
  "server": true,
  "sharedMappings": true,
  "world": {
    "format": "anvil"
  }
}