{
  "$schema": "https://skyrising.github.io/mc-versions/schemas/version.json",
  "client": true,
  "downloads": {
    "client": {
      "sha1": "925650c3ed9e1e79dd3f846a49a9de3a7f8e700c",
      "size": 9194941,
      "url": "https://launcher.mojang.com/v1/objects/925650c3ed9e1e79dd3f846a49a9de3a7f8e700c/client.jar"
    },
    "server": {
      "sha1": "d4d30a5433846d205974ace4cf34c9b294e0833f",
      "size": 9720347,
      "url": "https://launcher.mojang.com/v1/objects/d4d30a5433846d205974ace4cf34c9b294e0833f/server.jar"
    }
  },
  "id": "16w50a-1438",
  "libraries": [
    "com.google.code.gson:gson:2.2.4",
    "com.google.guava:guava:17.0",
    "com.ibm.icu:icu4j-core-mojang:51.2",
    "com.mojang:authlib:1.5.24",
    "com.mojang:netty:1.8.8",
    "com.mojang:realms:1.10.1",
    "com.paulscode:codecjorbis:20101023",
    "com.paulscode:codecwav:20101023",
    "com.paulscode:libraryjavasound:20101123",
    "com.paulscode:librarylwjglopenal:20100824",
    "com.paulscode:soundsystem:20120107",
    "commons-codec:commons-codec:1.9",
    "commons-io:commons-io:2.4",
    "commons-logging:commons-logging:1.1.3",
    "io.netty:netty-all:4.0.23.Final",
    "it.unimi.dsi:fastutil:7.0.12_mojang",
    "net.java.dev.jna:jna:3.4.0",
    "net.java.dev.jna:platform:3.4.0",
    "net.java.jinput:jinput-platform:2.0.5",
    "net.java.jinput:jinput:2.0.5",
    "net.java.jutils:jutils:1.0.0",
    "net.sf.jopt-simple:jopt-simple:4.6",
    "org.apache.commons:commons-compress:1.8.1",
    "org.apache.commons:commons-lang3:3.3.2",
    "org.apache.httpcomponents:httpclient:4.3.3",
    "org.apache.httpcomponents:httpcore:4.3.2",
    "org.apache.logging.log4j:log4j-api:2.0-beta9",
    "org.apache.logging.log4j:log4j-core:2.0-beta9",
    "org.lwjgl.lwjgl:lwjgl-platform:2.9.4-nightly-20150209",
    "org.lwjgl.lwjgl:lwjgl:2.9.4-nightly-20150209",
    "org.lwjgl.lwjgl:lwjgl_util:2.9.4-nightly-20150209",
    "oshi-project:oshi-core:1.1"
  ],
  "manifests": [
    {
      "assetHash": "4fa7f939c7e9902e6c674ad1d00358f8c08d7b8e",
      "assetIndex": "1.11",
      "downloads": "da79a4bc0d63f1057e9b68602e488deb608c80c2",
      "downloadsId": 1,
      "hash": "5829dc5e58d3d7d5d55417aa5290f12bd0481d5d",
      "lastModified": "2021-12-15T15:57:17+00:00",
      "time": "2016-12-15T14:38:52+00:00",
      "type": "snapshot",
      "url": "https://skyrising.github.io/mc-versions/manifest/5/8/29dc5e58d3d7d5d55417aa5290f12bd0481d5d/16w50a.json"
    },
    {
      "assetHash": "4fa7f939c7e9902e6c674ad1d00358f8c08d7b8e",
      "assetIndex": "1.11",
      "downloads": "da79a4bc0d63f1057e9b68602e488deb608c80c2",
      "downloadsId": 1,
      "hash": "c1bef2a0ec1759336e9e4c63071be42b00f4f5a1",
      "lastModified": "2021-07-07T14:00:49+00:00",
      "time": "2016-12-15T14:38:52+00:00",
      "type": "snapshot",
      "url": "https://skyrising.github.io/mc-versions/manifest/c/1/bef2a0ec1759336e9e4c63071be42b00f4f5a1/16w50a.json"
    },
    {
      "assetHash": "4fa7f939c7e9902e6c674ad1d00358f8c08d7b8e",
      "assetIndex": "1.11",
      "downloads": "da79a4bc0d63f1057e9b68602e488deb608c80c2",
      "downloadsId": 1,
      "hash": "78cdc6813ea2b31011e3cbe96c91bcf5c58af725",
      "lastModified": "2018-08-29T12:59:54+00:00",
      "time": "2016-12-15T14:38:52+00:00",
      "type": "snapshot",
      "url": "https://skyrising.github.io/mc-versions/manifest/7/8/cdc6813ea2b31011e3cbe96c91bcf5c58af725/16w50a.json"
    }
  ],
  "next": [
    "1.11.1"
  ],
  "normalizedVersion": "1.11.1-alpha.16.50.a+1438",
  "previous": [
    "1.11"
  ],
  "protocol": {
    "type": "netty",
    "version": 316
  },
  "releaseTarget": "1.11.1",
  "releaseTime": "2016-12-15T14:38:52+00:00",
  "server": true,
  "sharedMappings": true,
  "world": {
    "format": "anvil",
    "version": 920
  }
}