{
  "$schema": "https://skyrising.github.io/mc-versions/schemas/version.json",
  "client": true,
  "downloads": {
    "client": {
      "sha1": "7280ee42cce1c0371c96c95c22170d3aea7068bb",
      "size": 17842319,
      "url": "https://launcher.mojang.com/v1/objects/7280ee42cce1c0371c96c95c22170d3aea7068bb/client.jar"
    },
    "server": {
      "sha1": "1e80738a5360887bc93a46bdffb07699a45bf5a1",
      "size": 35200780,
      "url": "https://launcher.mojang.com/v1/objects/1e80738a5360887bc93a46bdffb07699a45bf5a1/server.jar"
    }
  },
  "id": "19w03a",
  "libraries": [
    "com.google.code.gson:gson:2.8.0",
    "com.google.guava:guava:21.0",
    "com.ibm.icu:icu4j-core-mojang:51.2",
    "com.mojang:authlib:1.5.25",
    "com.mojang:brigadier:1.0.14",
    "com.mojang:datafixerupper:2.0.23",
    "com.mojang:javabridge:1.0.22",
    "com.mojang:patchy:1.3.9",
    "com.mojang:realms:1.14.1",
    "com.mojang:text2speech:1.10.3",
    "com.paulscode:codecjorbis:20101023",
    "com.paulscode:codecwav:20101023",
    "com.paulscode:libraryjavasound:20101123",
    "com.paulscode:soundsystem:20120107",
    "commons-codec:commons-codec:1.10",
    "commons-io:commons-io:2.5",
    "commons-logging:commons-logging:1.1.3",
    "io.netty:netty-all:4.1.25.Final",
    "it.unimi.dsi:fastutil:8.2.1",
    "net.java.dev.jna:jna:4.4.0",
    "net.java.dev.jna:platform:3.4.0",
    "net.java.jinput:jinput:2.0.5",
    "net.java.jutils:jutils:1.0.0",
    "net.sf.jopt-simple:jopt-simple:5.0.3",
    "org.apache.commons:commons-compress:1.8.1",
    "org.apache.commons:commons-lang3:3.5",
    "org.apache.httpcomponents:httpclient:4.3.3",
    "org.apache.httpcomponents:httpcore:4.3.2",
    "org.apache.logging.log4j:log4j-api:2.8.1",
    "org.apache.logging.log4j:log4j-core:2.8.1",
    "org.lwjgl:lwjgl-glfw:3.1.6",
    "org.lwjgl:lwjgl-jemalloc:3.1.6",
    "org.lwjgl:lwjgl-openal:3.1.6",
    "org.lwjgl:lwjgl-opengl:3.1.6",
    "org.lwjgl:lwjgl-stb:3.1.6",
    "org.lwjgl:lwjgl:3.1.6",
    "oshi-project:oshi-core:1.1"
  ],
  "manifests": [
    {
      "assetHash": "d6c94fad4f7a03a8e46083c023926515fc0e551e",
      "assetIndex": "1.14",
      "downloads": "db2c80c4d931ad74cba6ddf854138c538a5f551a",
      "downloadsId": 1,
      "hash": "ffb4179a65b7b0a73ff310c81cf8fa4860116433",
      "lastModified": "2021-12-15T15:54:53+00:00",
      "time": "2019-01-16T16:45:02+00:00",
      "type": "snapshot",
      "url": "https://skyrising.github.io/mc-versions/manifest/f/f/b4179a65b7b0a73ff310c81cf8fa4860116433/19w03a.json"
    },
    {
      "assetHash": "d6c94fad4f7a03a8e46083c023926515fc0e551e",
      "assetIndex": "1.14",
      "downloads": "db2c80c4d931ad74cba6ddf854138c538a5f551a",
      "downloadsId": 1,
      "hash": "18d121b2f0c016a29876928893778696d0190e76",
      "lastModified": "2021-12-10T03:01:00+00:00",
      "time": "2019-01-16T16:45:02+00:00",
      "type": "snapshot",
      "url": "https://skyrising.github.io/mc-versions/manifest/1/8/d121b2f0c016a29876928893778696d0190e76/19w03a.json"
    },
    {
      "assetHash": "d6c94fad4f7a03a8e46083c023926515fc0e551e",
      "assetIndex": "1.14",
      "downloads": "db2c80c4d931ad74cba6ddf854138c538a5f551a",
      "downloadsId": 1,
      "hash": "8b82852f830c148644176c4e0c639bbab50b97ff",
      "lastModified": "2021-07-07T13:58:36+00:00",
      "time": "2019-01-16T16:45:02+00:00",
      "type": "snapshot",
      "url": "https://skyrising.github.io/mc-versions/manifest/8/b/82852f830c148644176c4e0c639bbab50b97ff/19w03a.json"
    },
    {
      "assetHash": "d6c94fad4f7a03a8e46083c023926515fc0e551e",
      "assetIndex": "1.14",
      "downloads": "db2c80c4d931ad74cba6ddf854138c538a5f551a",
      "downloadsId": 1,
      "hash": "4240d571c4259253aa504f261a24cba05ba2824a",
      "lastModified": "2019-08-22T12:49:10+00:00",
      "time": "2019-01-16T16:45:02+00:00",
      "type": "snapshot",
      "url": "https://skyrising.github.io/mc-versions/manifest/4/2/40d571c4259253aa504f261a24cba05ba2824a/19w03a.json"
    }
  ],
  "next": [
    "19w03b"
  ],
  "normalizedVersion": "1.14.0-alpha.19.3.a",
  "previous": [
    "19w02a"
  ],
  "protocol": {
    "type": "netty",
    "version": 453
  },
  "releaseTarget": "1.14",
  "releaseTime": "2019-01-16T16:45:02+00:00",
  "server": true,
  "sharedMappings": true,
  "world": {
    "format": "anvil",
    "version": 1922
  }
}