{
  "$schema": "https://skyrising.github.io/mc-versions/schemas/version.json",
  "client": true,
  "downloads": {
    "client": {
      "sha1": "1424fb2795c4d86ea034b868a2fd56c6ce6912d9",
      "size": 4998459,
      "url": "https://launcher.mojang.com/v1/objects/1424fb2795c4d86ea034b868a2fd56c6ce6912d9/client.jar"
    },
    "server": {
      "sha1": "03081b4b569174ec68ef9cdd574ee4feca05dea5",
      "size": 8726163,
      "url": "https://launcher.mojang.com/v1/objects/03081b4b569174ec68ef9cdd574ee4feca05dea5/server.jar"
    },
    "windows_server": {
      "sha1": "c5cd1c39b31d3b66e7c2620769a6d6a42ebce477",
      "size": 9121939,
      "url": "https://launcher.mojang.com/v1/objects/c5cd1c39b31d3b66e7c2620769a6d6a42ebce477/windows_server.exe"
    }
  },
  "id": "13w38c",
  "libraries": [
    "com.google.code.gson:gson:2.2.2",
    "com.google.guava:guava:14.0",
    "com.ibm.icu:icu4j-core-mojang:51.2",
    "com.paulscode:codecjorbis:20101023",
    "com.paulscode:codecwav:20101023",
    "com.paulscode:libraryjavasound:20101123",
    "com.paulscode:librarylwjglopenal:20100824",
    "com.paulscode:soundsystem:20120107",
    "commons-io:commons-io:2.4",
    "java3d:vecmath:1.3.1",
    "net.java.jinput:jinput-platform:2.0.5",
    "net.java.jinput:jinput:2.0.5",
    "net.java.jutils:jutils:1.0.0",
    "net.sf.jopt-simple:jopt-simple:4.5",
    "net.sf.trove4j:trove4j:3.0.3",
    "org.apache.commons:commons-lang3:3.1",
    "org.bouncycastle:bcprov-jdk15on:1.47",
    "org.lwjgl.lwjgl:lwjgl-platform:2.9.0",
    "org.lwjgl.lwjgl:lwjgl:2.9.0",
    "org.lwjgl.lwjgl:lwjgl_util:2.9.0"
  ],
  "manifests": [
    {
      "assetHash": "770572e819335b6c0a053f8378ad88eda189fc14",
      "assetIndex": "legacy",
      "downloads": "41669d47166846b33d69b552e9906f01e2ba5da5",
      "downloadsId": 1,
      "hash": "74d1fcc1a78fee5545231656ae45c41f0b9a38f6",
      "lastModified": "2018-08-29T13:02:35+00:00",
      "time": "2013-09-20T15:11:34+00:00",
      "type": "snapshot",
      "url": "https://skyrising.github.io/mc-versions/manifest/7/4/d1fcc1a78fee5545231656ae45c41f0b9a38f6/13w38c.json"
    }
  ],
  "next": [
    "13w39a"
  ],
  "normalizedVersion": "1.7.0-alpha.13.38.c",
  "previous": [
    "13w38b"
  ],
  "protocol": {
    "type": "modern",
    "version": 79
  },
  "releaseTarget": "1.7",
  "releaseTime": "2013-09-20T15:11:34+00:00",
  "server": true,
  "sharedMappings": true,
  "world": {
    "format": "anvil"
  }
}