{
  "$schema": "https://skyrising.github.io/mc-versions/schemas/version.json",
  "client": true,
  "downloads": {
    "client": {
      "sha1": "c0898ec7c6a5a2eaa317770203a1554260699994",
      "size": 21462385,
      "url": "https://launcher.mojang.com/v1/objects/c0898ec7c6a5a2eaa317770203a1554260699994/client.jar"
    },
    "client_mappings": {
      "sha1": "150346d1c0b4acec0b4eb7f58b86e3ea1aa730f3",
      "size": 7123832,
      "url": "https://launcher.mojang.com/v1/objects/150346d1c0b4acec0b4eb7f58b86e3ea1aa730f3/client.txt"
    },
    "server": {
      "sha1": "e00c4052dac1d59a1188b2aa9d5a87113aaf1122",
      "size": 45538778,
      "url": "https://launcher.mojang.com/v1/objects/e00c4052dac1d59a1188b2aa9d5a87113aaf1122/server.jar"
    },
    "server_mappings": {
      "sha1": "1c1cea17d5cd63d68356df2ef31e724dd09f8c26",
      "size": 5552032,
      "url": "https://launcher.mojang.com/v1/objects/1c1cea17d5cd63d68356df2ef31e724dd09f8c26/server.txt"
    }
  },
  "id": "1.19",
  "libraries": [
    "com.github.oshi:oshi-core:5.8.5",
    "com.google.code.gson:gson:2.8.9",
    "com.google.guava:failureaccess:1.0.1",
    "com.google.guava:guava:31.0.1-jre",
    "com.ibm.icu:icu4j:70.1",
    "com.mojang:authlib:3.5.41",
    "com.mojang:blocklist:1.0.10",
    "com.mojang:brigadier:1.0.18",
    "com.mojang:datafixerupper:5.0.28",
    "com.mojang:javabridge:1.2.24",
    "com.mojang:logging:1.0.0",
    "com.mojang:patchy:2.2.10",
    "com.mojang:text2speech:1.13.9",
    "commons-codec:commons-codec:1.15",
    "commons-io:commons-io:2.11.0",
    "commons-logging:commons-logging:1.2",
    "io.netty:netty-buffer:4.1.77.Final",
    "io.netty:netty-codec:4.1.77.Final",
    "io.netty:netty-common:4.1.77.Final",
    "io.netty:netty-handler:4.1.77.Final",
    "io.netty:netty-resolver:4.1.77.Final",
    "io.netty:netty-transport-classes-epoll:4.1.77.Final",
    "io.netty:netty-transport-native-unix-common:4.1.77.Final",
    "io.netty:netty-transport:4.1.77.Final",
    "it.unimi.dsi:fastutil:8.5.6",
    "net.java.dev.jna:jna-platform:5.10.0",
    "net.java.dev.jna:jna:5.10.0",
    "net.sf.jopt-simple:jopt-simple:5.0.4",
    "org.apache.commons:commons-compress:1.21",
    "org.apache.commons:commons-lang3:3.12.0",
    "org.apache.httpcomponents:httpclient:4.5.13",
    "org.apache.httpcomponents:httpcore:4.4.14",
    "org.apache.logging.log4j:log4j-api:2.17.0",
    "org.apache.logging.log4j:log4j-core:2.17.0",
    "org.apache.logging.log4j:log4j-slf4j18-impl:2.17.0",
    "org.lwjgl:lwjgl-glfw:3.3.1",
    "org.lwjgl:lwjgl-jemalloc:3.3.1",
    "org.lwjgl:lwjgl-openal:3.3.1",
    "org.lwjgl:lwjgl-opengl:3.3.1",
    "org.lwjgl:lwjgl-stb:3.3.1",
    "org.lwjgl:lwjgl-tinyfd:3.3.1",
    "org.lwjgl:lwjgl:3.3.1",
    "org.slf4j:slf4j-api:1.8.0-beta4"
  ],
  "manifests": [
    {
      "assetHash": "4f4d42f50fe8ba9b5d0d4ae63993c71b46df7622",
      "assetIndex": "1.19",
      "downloads": "3afb3c3c00a8cb8a3d6e46dbab27283f66ee3e33",
      "downloadsId": 1,
      "hash": "0b5a88a99e130fd7395d8464c8a6cdfc8222ddb9",
      "lastModified": "2022-07-08T12:15:04+00:00",
      "time": "2022-06-07T09:42:18+00:00",
      "type": "release",
      "url": "https://skyrising.github.io/mc-versions/manifest/0/b/5a88a99e130fd7395d8464c8a6cdfc8222ddb9/1.19.json"
    },
    {
      "assetHash": "298a5e9205e475561c78b5ead43cb94de9ffa751",
      "assetIndex": "1.19",
      "downloads": "3afb3c3c00a8cb8a3d6e46dbab27283f66ee3e33",
      "downloadsId": 1,
      "hash": "76969a8f0751a4d62dd6c8c401d85b0d1e3d977d",
      "lastModified": "2022-07-06T14:58:47+00:00",
      "time": "2022-06-07T09:42:18+00:00",
      "type": "release",
      "url": "https://skyrising.github.io/mc-versions/manifest/7/6/969a8f0751a4d62dd6c8c401d85b0d1e3d977d/1.19.json"
    },
    {
      "assetHash": "580577f39d2b80a9498d0f54a43d5d50e1f431e2",
      "assetIndex": "1.19",
      "downloads": "3afb3c3c00a8cb8a3d6e46dbab27283f66ee3e33",
      "downloadsId": 1,
      "hash": "3cbd598a2054a217b7a55c75d76d0f704e6618ac",
      "lastModified": "2022-06-30T16:03:21+00:00",
      "time": "2022-06-07T09:42:18+00:00",
      "type": "release",
      "url": "https://skyrising.github.io/mc-versions/manifest/3/c/bd598a2054a217b7a55c75d76d0f704e6618ac/1.19.json"
    },
    {
      "assetHash": "0a4c73f7a55f2052b163739b96874a644551e9e4",
      "assetIndex": "1.19",
      "downloads": "3afb3c3c00a8cb8a3d6e46dbab27283f66ee3e33",
      "downloadsId": 1,
      "hash": "eab1b699b3b036e846d11e077c6da5375637f591",
      "lastModified": "2022-06-23T16:40:43+00:00",
      "time": "2022-06-07T09:42:18+00:00",
      "type": "release",
      "url": "https://skyrising.github.io/mc-versions/manifest/e/a/b1b699b3b036e846d11e077c6da5375637f591/1.19.json"
    },
    {
      "assetHash": "7f06db11c5a2b34d478b1de8142783654bde2aa2",
      "assetIndex": "1.19",
      "downloads": "3afb3c3c00a8cb8a3d6e46dbab27283f66ee3e33",
      "downloadsId": 1,
      "hash": "6bf2e20e61b9a95b6fa9f9225fa4d3a2fe5fceca",
      "lastModified": "2022-06-21T17:21:55+00:00",
      "time": "2022-06-07T09:42:18+00:00",
      "type": "release",
      "url": "https://skyrising.github.io/mc-versions/manifest/6/b/f2e20e61b9a95b6fa9f9225fa4d3a2fe5fceca/1.19.json"
    },
    {
      "assetHash": "d45eb5e0c20e5d753468de3d68b05c45a946f49b",
      "assetIndex": "1.19",
      "downloads": "3afb3c3c00a8cb8a3d6e46dbab27283f66ee3e33",
      "downloadsId": 1,
      "hash": "2f0e08416f8dc4c2001648d60c1d24a02d2335a7",
      "lastModified": "2022-06-15T16:29:13+00:00",
      "time": "2022-06-07T09:42:18+00:00",
      "type": "release",
      "url": "https://skyrising.github.io/mc-versions/manifest/2/f/0e08416f8dc4c2001648d60c1d24a02d2335a7/1.19.json"
    },
    {
      "assetHash": "4d2c1138477c7aafe8fb370de11ea5b23a963edc",
      "assetIndex": "1.19",
      "downloads": "3afb3c3c00a8cb8a3d6e46dbab27283f66ee3e33",
      "downloadsId": 1,
      "hash": "c0d63faac750c6fcac0d655092373133baf0b957",
      "lastModified": "2022-06-08T15:08:30+00:00",
      "time": "2022-06-07T09:42:18+00:00",
      "type": "release",
      "url": "https://skyrising.github.io/mc-versions/manifest/c/0/d63faac750c6fcac0d655092373133baf0b957/1.19.json"
    },
    {
      "assetHash": "72f061c25c8a96c4b8dd9b5609a6da6a8fb7fd73",
      "assetIndex": "1.19",
      "downloads": "3afb3c3c00a8cb8a3d6e46dbab27283f66ee3e33",
      "downloadsId": 1,
      "hash": "63b3a629bd070850a5c0821e502b6b5048fbe153",
      "lastModified": "2022-06-07T09:49:18+00:00",
      "time": "2022-06-07T09:42:18+00:00",
      "type": "release",
      "url": "https://skyrising.github.io/mc-versions/manifest/6/3/b3a629bd070850a5c0821e502b6b5048fbe153/1.19.json"
    }
  ],
  "next": [
    "22w24a"
  ],
  "normalizedVersion": "1.19.0",
  "previous": [
    "1.19-rc2"
  ],
  "protocol": {
    "type": "netty",
    "version": 759
  },
  "releaseTarget": "1.19",
  "releaseTime": "2022-06-07T09:42:18+00:00",
  "server": true,
  "sharedMappings": true,
  "world": {
    "format": "anvil",
    "version": 3105
  }
}