{
  "$schema": "https://skyrising.github.io/mc-versions/schemas/version.json",
  "client": true,
  "downloads": {
    "client": {
      "sha1": "dd6cb06d65063769f7581ac2f5f800fe9531e28a",
      "size": 22748586,
      "url": "https://piston-data.mojang.com/v1/objects/dd6cb06d65063769f7581ac2f5f800fe9531e28a/client.jar"
    },
    "client_mappings": {
      "sha1": "f7de4f767c3d8d9c5c4779933f175eeb738d7f65",
      "size": 7608661,
      "url": "https://piston-data.mojang.com/v1/objects/f7de4f767c3d8d9c5c4779933f175eeb738d7f65/client.txt"
    },
    "server": {
      "sha1": "b033d57035b293a9eda548db0615c1c89c21ea28",
      "size": 47187437,
      "url": "https://piston-data.mojang.com/v1/objects/b033d57035b293a9eda548db0615c1c89c21ea28/server.jar"
    },
    "server_mappings": {
      "sha1": "030aa6a26885d62a55864b16e1a2000ba91de726",
      "size": 5871550,
      "url": "https://piston-data.mojang.com/v1/objects/030aa6a26885d62a55864b16e1a2000ba91de726/server.txt"
    }
  },
  "id": "23w03a",
  "libraries": [
    "com.github.oshi:oshi-core:6.2.2",
    "com.google.code.gson:gson:2.10",
    "com.google.guava:failureaccess:1.0.1",
    "com.google.guava:guava:31.1-jre",
    "com.ibm.icu:icu4j:71.1",
    "com.mojang:authlib:3.16.29",
    "com.mojang:blocklist:1.0.10",
    "com.mojang:brigadier:1.0.18",
    "com.mojang:datafixerupper:5.0.28",
    "com.mojang:logging:1.1.1",
    "com.mojang:patchy:2.2.10",
    "com.mojang:text2speech:1.13.9",
    "commons-codec:commons-codec:1.15",
    "commons-io:commons-io:2.11.0",
    "commons-logging:commons-logging:1.2",
    "io.netty:netty-buffer:4.1.82.Final",
    "io.netty:netty-codec:4.1.82.Final",
    "io.netty:netty-common:4.1.82.Final",
    "io.netty:netty-handler:4.1.82.Final",
    "io.netty:netty-resolver:4.1.82.Final",
    "io.netty:netty-transport-classes-epoll:4.1.82.Final",
    "io.netty:netty-transport-native-unix-common:4.1.82.Final",
    "io.netty:netty-transport:4.1.82.Final",
    "it.unimi.dsi:fastutil:8.5.9",
    "net.java.dev.jna:jna-platform:5.12.1",
    "net.java.dev.jna:jna:5.12.1",
    "net.sf.jopt-simple:jopt-simple:5.0.4",
    "org.apache.commons:commons-compress:1.21",
    "org.apache.commons:commons-lang3:3.12.0",
    "org.apache.httpcomponents:httpclient:4.5.13",
    "org.apache.httpcomponents:httpcore:4.4.15",
    "org.apache.logging.log4j:log4j-api:2.19.0",
    "org.apache.logging.log4j:log4j-core:2.19.0",
    "org.apache.logging.log4j:log4j-slf4j2-impl:2.19.0",
    "org.joml:joml:1.10.5",
    "org.lwjgl:lwjgl-glfw:3.3.1",
    "org.lwjgl:lwjgl-jemalloc:3.3.1",
    "org.lwjgl:lwjgl-openal:3.3.1",
    "org.lwjgl:lwjgl-opengl:3.3.1",
    "org.lwjgl:lwjgl-stb:3.3.1",
    "org.lwjgl:lwjgl-tinyfd:3.3.1",
    "org.lwjgl:lwjgl:3.3.1",
    "org.slf4j:slf4j-api:2.0.1"
  ],
  "manifests": [
    {
      "assetHash": "b5d533e30f493be215e805f1affb572b73a27dad",
      "assetIndex": "2",
      "downloads": "76c3f0c654694273fd3cf17578153f36a36ae9e8",
      "downloadsId": 1,
      "hash": "732c29bf85113da17ea4b9aa9c0535f5c8fa6ad7",
      "lastModified": "2023-02-01T14:36:18+00:00",
      "time": "2023-01-18T13:10:31+00:00",
      "type": "snapshot",
      "url": "https://skyrising.github.io/mc-versions/manifest/7/3/2c29bf85113da17ea4b9aa9c0535f5c8fa6ad7/23w03a.json"
    },
    {
      "assetHash": "63b14365d7df8a206d2fae60e3400d84bab5a7a4",
      "assetIndex": "2",
      "downloads": "76c3f0c654694273fd3cf17578153f36a36ae9e8",
      "downloadsId": 1,
      "hash": "3f1db363e2e6c5dc41d6a9de9e3ae51e38f0d788",
      "lastModified": "2023-01-24T15:38:24+00:00",
      "time": "2023-01-18T13:10:31+00:00",
      "type": "snapshot",
      "url": "https://skyrising.github.io/mc-versions/manifest/3/f/1db363e2e6c5dc41d6a9de9e3ae51e38f0d788/23w03a.json"
    },
    {
      "assetHash": "f465df3c585b67233e863479efd6b7dbf86aa68e",
      "assetIndex": "2",
      "downloads": "76c3f0c654694273fd3cf17578153f36a36ae9e8",
      "downloadsId": 1,
      "hash": "f16a69f6e465420c8ce6941774c62ed6b651a79a",
      "lastModified": "2023-01-18T13:30:24+00:00",
      "time": "2023-01-18T13:10:31+00:00",
      "type": "snapshot",
      "url": "https://skyrising.github.io/mc-versions/manifest/f/1/6a69f6e465420c8ce6941774c62ed6b651a79a/23w03a.json"
    }
  ],
  "next": [
    "23w04a"
  ],
  "normalizedVersion": "1.19.4-alpha.23.3.a",
  "previous": [
    "1.19.3"
  ],
  "protocol": {
    "type": "netty-snapshot",
    "version": 115
  },
  "releaseTarget": "1.19.4",
  "releaseTime": "2023-01-18T13:10:31+00:00",
  "server": true,
  "sharedMappings": true,
  "world": {
    "format": "anvil",
    "version": 3320
  }
}