{
  "$schema": "https://skyrising.github.io/mc-versions/schemas/version.json",
  "client": true,
  "downloads": {
    "client": {
      "sha1": "24e28d53aecff54ff9be2a1ba1ffe008b86f7ed6",
      "size": 5338685,
      "url": "https://launcher.mojang.com/v1/objects/24e28d53aecff54ff9be2a1ba1ffe008b86f7ed6/client.jar"
    },
    "server": {
      "sha1": "5aa5deddbe750a384bdb5ed0652bbda33cf4e5c8",
      "size": 9480864,
      "url": "https://launcher.mojang.com/v1/objects/5aa5deddbe750a384bdb5ed0652bbda33cf4e5c8/server.jar"
    },
    "windows_server": {
      "sha1": "f2e07d3d06e4daba5d107f5d1e59324ee25e4679",
      "size": 9875104,
      "url": "https://launcher.mojang.com/v1/objects/f2e07d3d06e4daba5d107f5d1e59324ee25e4679/windows_server.exe"
    }
  },
  "id": "1.7.6-pre2",
  "libraries": [
    "com.google.code.gson:gson:2.2.4",
    "com.google.guava:guava:15.0",
    "com.ibm.icu:icu4j-core-mojang:51.2",
    "com.mojang:authlib:1.5.5",
    "com.mojang:netty:1.8.8",
    "com.paulscode:codecjorbis:20101023",
    "com.paulscode:codecwav:20101023",
    "com.paulscode:libraryjavasound:20101123",
    "com.paulscode:librarylwjglopenal:20100824",
    "com.paulscode:soundsystem:20120107",
    "commons-codec:commons-codec:1.9",
    "commons-io:commons-io:2.4",
    "io.netty:netty-all:4.0.10.Final",
    "java3d:vecmath:1.3.1",
    "net.java.jinput:jinput-platform:2.0.5",
    "net.java.jinput:jinput:2.0.5",
    "net.java.jutils:jutils:1.0.0",
    "net.sf.jopt-simple:jopt-simple:4.5",
    "net.sf.trove4j:trove4j:3.0.3",
    "org.apache.commons:commons-lang3:3.1",
    "org.apache.logging.log4j:log4j-api:2.0-beta9",
    "org.apache.logging.log4j:log4j-core:2.0-beta9",
    "org.lwjgl.lwjgl:lwjgl-platform:2.9.1",
    "org.lwjgl.lwjgl:lwjgl:2.9.1",
    "org.lwjgl.lwjgl:lwjgl_util:2.9.1",
    "tv.twitch:twitch-platform:5.16",
    "tv.twitch:twitch:5.16"
  ],
  "manifests": [
    {
      "assetHash": "545510a60f526b9aa8a38f9c0bc7a74235d21675",
      "assetIndex": "1.7.4",
      "downloads": "4cbd6976a6b67a16ebc8e3ee388b7ce3836fce01",
      "downloadsId": 1,
      "hash": "ba4dcff2b09e8b070d43a213d6abc87bde19437a",
      "lastModified": "2021-12-15T16:01:01+00:00",
      "time": "2014-03-08T11:00:01+00:00",
      "type": "snapshot",
      "url": "https://skyrising.github.io/mc-versions/manifest/b/a/4dcff2b09e8b070d43a213d6abc87bde19437a/1.7.6-pre2.json"
    },
    {
      "assetHash": "545510a60f526b9aa8a38f9c0bc7a74235d21675",
      "assetIndex": "1.7.4",
      "downloads": "4cbd6976a6b67a16ebc8e3ee388b7ce3836fce01",
      "downloadsId": 1,
      "hash": "09aeca43c0582659a38143ca9b55616a8a2d8b58",
      "lastModified": "2021-07-07T14:04:15+00:00",
      "time": "2014-03-08T11:00:01+00:00",
      "type": "snapshot",
      "url": "https://skyrising.github.io/mc-versions/manifest/0/9/aeca43c0582659a38143ca9b55616a8a2d8b58/1.7.6-pre2.json"
    },
    {
      "assetHash": "545510a60f526b9aa8a38f9c0bc7a74235d21675",
      "assetIndex": "1.7.4",
      "downloads": "4cbd6976a6b67a16ebc8e3ee388b7ce3836fce01",
      "downloadsId": 1,
      "hash": "3de9556107748d7acca8b52874f65a9286787f45",
      "lastModified": "2018-08-29T13:02:11+00:00",
      "time": "2014-03-08T11:00:01+00:00",
      "type": "snapshot",
      "url": "https://skyrising.github.io/mc-versions/manifest/3/d/e9556107748d7acca8b52874f65a9286787f45/1.7.6-pre2.json"
    }
  ],
  "next": [
    "1.7.6"
  ],
  "normalizedVersion": "1.7.6-pre.2",
  "previous": [
    "1.7.6-pre1"
  ],
  "protocol": {
    "type": "netty",
    "version": 5
  },
  "releaseTarget": "1.7.6",
  "releaseTime": "2014-04-04T00:00:00+00:00",
  "server": true,
  "sharedMappings": true,
  "world": {
    "format": "anvil"
  }
}