{
  "$schema": "https://skyrising.github.io/mc-versions/schemas/version.json",
  "client": true,
  "downloads": {
    "client": {
      "sha1": "12f85e0b940f3649c9ecb5a3201811f56992e5c0",
      "size": 18747283,
      "url": "https://launcher.mojang.com/v1/objects/12f85e0b940f3649c9ecb5a3201811f56992e5c0/client.jar"
    },
    "server": {
      "sha1": "6b747e1338e1aa058146032a659cf654c446552d",
      "size": 35900398,
      "url": "https://launcher.mojang.com/v1/objects/6b747e1338e1aa058146032a659cf654c446552d/server.jar"
    }
  },
  "id": "1.14-pre3",
  "libraries": [
    "com.google.code.gson:gson:2.8.0",
    "com.google.guava:guava:21.0",
    "com.ibm.icu:icu4j-core-mojang:51.2",
    "com.mojang:authlib:1.5.25",
    "com.mojang:brigadier:1.0.17",
    "com.mojang:datafixerupper:2.0.24",
    "com.mojang:javabridge:1.0.22",
    "com.mojang:patchy:1.3.9",
    "com.mojang:realms:1.14.8",
    "com.mojang:text2speech:1.11.3",
    "commons-codec:commons-codec:1.10",
    "commons-io:commons-io:2.5",
    "commons-logging:commons-logging:1.1.3",
    "io.netty:netty-all:4.1.25.Final",
    "it.unimi.dsi:fastutil:8.2.1",
    "net.java.dev.jna:jna:4.4.0",
    "net.java.dev.jna:platform:3.4.0",
    "net.java.jinput:jinput:2.0.5",
    "net.java.jutils:jutils:1.0.0",
    "net.sf.jopt-simple:jopt-simple:5.0.3",
    "org.apache.commons:commons-compress:1.8.1",
    "org.apache.commons:commons-lang3:3.5",
    "org.apache.httpcomponents:httpclient:4.3.3",
    "org.apache.httpcomponents:httpcore:4.3.2",
    "org.apache.logging.log4j:log4j-api:2.8.1",
    "org.apache.logging.log4j:log4j-core:2.8.1",
    "org.lwjgl:lwjgl-glfw:3.2.1",
    "org.lwjgl:lwjgl-jemalloc:3.2.1",
    "org.lwjgl:lwjgl-openal:3.2.1",
    "org.lwjgl:lwjgl-opengl:3.2.1",
    "org.lwjgl:lwjgl-stb:3.2.1",
    "org.lwjgl:lwjgl:3.2.1",
    "oshi-project:oshi-core:1.1"
  ],
  "manifests": [
    {
      "assetHash": "d6c94fad4f7a03a8e46083c023926515fc0e551e",
      "assetIndex": "1.14",
      "downloads": "53999aa6514192dccafd648cc08a2638f984bc96",
      "downloadsId": 1,
      "hash": "afc93c4946c93e90f0c98034bbfccaa8f41b2891",
      "lastModified": "2021-12-15T15:54:21+00:00",
      "time": "2019-04-16T13:57:10+00:00",
      "type": "snapshot",
      "url": "https://skyrising.github.io/mc-versions/manifest/a/f/c93c4946c93e90f0c98034bbfccaa8f41b2891/1.14%20Pre-Release%203.json"
    },
    {
      "assetHash": "d6c94fad4f7a03a8e46083c023926515fc0e551e",
      "assetIndex": "1.14",
      "downloads": "53999aa6514192dccafd648cc08a2638f984bc96",
      "downloadsId": 1,
      "hash": "12a0e962034414654519d8cf6f4455708b5492e4",
      "lastModified": "2021-12-10T03:00:31+00:00",
      "time": "2019-04-16T13:57:10+00:00",
      "type": "snapshot",
      "url": "https://skyrising.github.io/mc-versions/manifest/1/2/a0e962034414654519d8cf6f4455708b5492e4/1.14%20Pre-Release%203.json"
    },
    {
      "assetHash": "d6c94fad4f7a03a8e46083c023926515fc0e551e",
      "assetIndex": "1.14",
      "downloads": "53999aa6514192dccafd648cc08a2638f984bc96",
      "downloadsId": 1,
      "hash": "1f8c8d9cd34dc7e0bb1c079e3001db31ea249eed",
      "lastModified": "2021-07-07T13:58:07+00:00",
      "time": "2019-04-16T13:57:10+00:00",
      "type": "snapshot",
      "url": "https://skyrising.github.io/mc-versions/manifest/1/f/8c8d9cd34dc7e0bb1c079e3001db31ea249eed/1.14%20Pre-Release%203.json"
    },
    {
      "assetHash": "d6c94fad4f7a03a8e46083c023926515fc0e551e",
      "assetIndex": "1.14",
      "downloads": "53999aa6514192dccafd648cc08a2638f984bc96",
      "downloadsId": 1,
      "hash": "a276012e0ab0d6b54d38e7a402bc373413d65b4d",
      "lastModified": "2019-08-22T12:48:49+00:00",
      "time": "2019-04-16T13:57:10+00:00",
      "type": "snapshot",
      "url": "https://skyrising.github.io/mc-versions/manifest/a/2/76012e0ab0d6b54d38e7a402bc373413d65b4d/1.14_Pre-Release_3.json"
    }
  ],
  "next": [
    "1.14-pre4"
  ],
  "normalizedVersion": "1.14.0-pre.3",
  "previous": [
    "1.14-pre2"
  ],
  "protocol": {
    "type": "netty",
    "version": 474
  },
  "releaseTarget": "1.14",
  "releaseTime": "2019-04-16T13:57:10+00:00",
  "server": true,
  "sharedMappings": true,
  "world": {
    "format": "anvil",
    "version": 1949
  }
}