{
  "$schema": "https://skyrising.github.io/mc-versions/schemas/version.json",
  "client": true,
  "downloads": {
    "client": {
      "sha1": "3631a714cb465d39f5cb5c18aa23abf38031b359",
      "size": 4542344,
      "url": "https://files.betacraft.uk/launcher/assets/versions/1.3/12w22a.jar"
    },
    "server": {
      "sha1": "110a02fc92768a66ca32f73376e17d62518070ba",
      "size": 1766213,
      "url": "https://files.betacraft.uk/server-archive/release/1.3/prerelease/12w22a.jar"
    },
    "windows_server": {
      "sha1": "d6c4330b25544b543107b1e10e189ea44feb63d1",
      "size": 1947461,
      "url": "https://files.betacraft.uk/server-archive/release/1.3/prerelease/12w22a.exe"
    }
  },
  "id": "12w22a",
  "libraries": [
    "net.java.jinput:jinput-platform:2.0.5",
    "net.java.jinput:jinput:2.0.5",
    "net.java.jutils:jutils:1.0.0",
    "net.minecraft:launchwrapper:1.5",
    "net.sf.jopt-simple:jopt-simple:4.5",
    "org.lwjgl.lwjgl:lwjgl-platform:2.9.0",
    "org.lwjgl.lwjgl:lwjgl:2.9.0",
    "org.lwjgl.lwjgl:lwjgl_util:2.9.0",
    "org.ow2.asm:asm-all:4.1"
  ],
  "manifests": [
    {
      "assetHash": "4759bad2824e419da9db32861fcdc3a274336532",
      "assetIndex": "pre-1.6",
      "downloads": "3d12fac19d57c246b84f8c0345808cdf6c607df3",
      "downloadsId": 1,
      "hash": "ce3de9c4b1e678e86f44527666a2921d8e05bd73",
      "time": "2012-05-31T09:20:18+00:00",
      "type": "snapshot",
      "url": "https://skyrising.github.io/mc-versions/manifest/c/e/3de9c4b1e678e86f44527666a2921d8e05bd73/12w22a.json"
    }
  ],
  "next": [
    "12w23a"
  ],
  "normalizedVersion": "1.3.0-alpha.12.22.a",
  "previous": [
    "12w21b"
  ],
  "protocol": {
    "type": "modern",
    "version": 34
  },
  "releaseTarget": "1.3",
  "releaseTime": "2012-05-31T09:20:18+00:00",
  "server": true,
  "sharedMappings": false,
  "world": {
    "format": "anvil"
  }
}