{
  "$schema": "https://skyrising.github.io/mc-versions/schemas/version.json",
  "client": true,
  "downloads": {
    "client": {
      "sha1": "1367ef1410c2ce7ac0f1c58727aa4883c8677469",
      "size": 5533426,
      "url": "https://assets.minecraft.net/13w09c/minecraft.jar"
    },
    "server": {
      "sha1": "02b4297ed54620128a5e6da3eb4de35399e97583",
      "size": 2336343,
      "url": "https://assets.minecraft.net/13w09c/minecraft_server.jar"
    },
    "windows_server": {
      "sha1": "694b934fdcd0d0f16c2bc6186709f42e9ca61f69",
      "size": 2517591,
      "url": "https://assets.minecraft.net/13w09c/Minecraft_Server.exe"
    }
  },
  "id": "13w09c",
  "libraries": [
    "net.java.jinput:jinput-platform:2.0.5",
    "net.java.jinput:jinput:2.0.5",
    "net.java.jutils:jutils:1.0.0",
    "net.minecraft:launchwrapper:1.5",
    "net.sf.jopt-simple:jopt-simple:4.5",
    "org.lwjgl.lwjgl:lwjgl-platform:2.9.0",
    "org.lwjgl.lwjgl:lwjgl:2.9.0",
    "org.lwjgl.lwjgl:lwjgl_util:2.9.0",
    "org.ow2.asm:asm-all:4.1"
  ],
  "manifests": [
    {
      "assetHash": "4759bad2824e419da9db32861fcdc3a274336532",
      "assetIndex": "pre-1.6",
      "downloads": "28232e5db248f418355b0f4531f912ee59c03624",
      "downloadsId": 1,
      "hash": "e685068275acd8566eb48dec7b5b8b37d7a8e099",
      "time": "2013-03-01T14:58:38+00:00",
      "type": "snapshot",
      "url": "https://skyrising.github.io/mc-versions/manifest/e/6/85068275acd8566eb48dec7b5b8b37d7a8e099/13w09c.json"
    }
  ],
  "next": [
    "13w10a"
  ],
  "normalizedVersion": "1.5.0-alpha.13.9.c",
  "previous": [
    "13w09b"
  ],
  "protocol": {
    "type": "modern",
    "version": 60
  },
  "releaseTarget": "1.5",
  "releaseTime": "2013-03-01T14:58:38+00:00",
  "server": true,
  "sharedMappings": true,
  "world": {
    "format": "anvil"
  }
}