{
  "$schema": "https://skyrising.github.io/mc-versions/schemas/version.json",
  "client": true,
  "downloads": {
    "client": {
      "sha1": "e565f6a8dacc85b81faaf17e4a13125b2ad5c335",
      "size": 8889021,
      "url": "https://launcher.mojang.com/v1/objects/e565f6a8dacc85b81faaf17e4a13125b2ad5c335/client.jar"
    },
    "server": {
      "sha1": "dfdda3e5ba769ba0634ad43ca1124a401d6addca",
      "size": 9482198,
      "url": "https://launcher.mojang.com/v1/objects/dfdda3e5ba769ba0634ad43ca1124a401d6addca/server.jar"
    }
  },
  "id": "16w33a",
  "libraries": [
    "com.google.code.gson:gson:2.2.4",
    "com.google.guava:guava:17.0",
    "com.ibm.icu:icu4j-core-mojang:51.2",
    "com.mojang:authlib:1.5.22",
    "com.mojang:netty:1.8.8",
    "com.mojang:realms:1.9.3",
    "com.paulscode:codecjorbis:20101023",
    "com.paulscode:codecwav:20101023",
    "com.paulscode:libraryjavasound:20101123",
    "com.paulscode:librarylwjglopenal:20100824",
    "com.paulscode:soundsystem:20120107",
    "commons-codec:commons-codec:1.9",
    "commons-io:commons-io:2.4",
    "commons-logging:commons-logging:1.1.3",
    "io.netty:netty-all:4.0.23.Final",
    "it.unimi.dsi:fastutil:7.0.12_mojang",
    "net.java.dev.jna:jna:3.4.0",
    "net.java.dev.jna:platform:3.4.0",
    "net.java.jinput:jinput-platform:2.0.5",
    "net.java.jinput:jinput:2.0.5",
    "net.java.jutils:jutils:1.0.0",
    "net.sf.jopt-simple:jopt-simple:4.6",
    "org.apache.commons:commons-compress:1.8.1",
    "org.apache.commons:commons-lang3:3.3.2",
    "org.apache.httpcomponents:httpclient:4.3.3",
    "org.apache.httpcomponents:httpcore:4.3.2",
    "org.apache.logging.log4j:log4j-api:2.0-beta9",
    "org.apache.logging.log4j:log4j-core:2.0-beta9",
    "org.lwjgl.lwjgl:lwjgl-platform:2.9.4-nightly-20150209",
    "org.lwjgl.lwjgl:lwjgl:2.9.4-nightly-20150209",
    "org.lwjgl.lwjgl:lwjgl_util:2.9.4-nightly-20150209",
    "oshi-project:oshi-core:1.1"
  ],
  "manifests": [
    {
      "assetHash": "4fa7f939c7e9902e6c674ad1d00358f8c08d7b8e",
      "assetIndex": "1.11",
      "downloads": "1f1eacd6de1c2f9d1fecebddcf42c3254e403252",
      "downloadsId": 1,
      "hash": "af926a6f83f05a29f4412bf3b47fa1da868002d5",
      "lastModified": "2021-12-15T15:57:35+00:00",
      "time": "2016-08-17T12:48:57+00:00",
      "type": "snapshot",
      "url": "https://skyrising.github.io/mc-versions/manifest/a/f/926a6f83f05a29f4412bf3b47fa1da868002d5/16w33a.json"
    },
    {
      "assetHash": "4fa7f939c7e9902e6c674ad1d00358f8c08d7b8e",
      "assetIndex": "1.11",
      "downloads": "1f1eacd6de1c2f9d1fecebddcf42c3254e403252",
      "downloadsId": 1,
      "hash": "2337af653ba055ec8ee23b89bd107e37de848a66",
      "lastModified": "2021-07-07T14:01:05+00:00",
      "time": "2016-08-17T12:48:57+00:00",
      "type": "snapshot",
      "url": "https://skyrising.github.io/mc-versions/manifest/2/3/37af653ba055ec8ee23b89bd107e37de848a66/16w33a.json"
    },
    {
      "assetHash": "4fa7f939c7e9902e6c674ad1d00358f8c08d7b8e",
      "assetIndex": "1.11",
      "downloads": "1f1eacd6de1c2f9d1fecebddcf42c3254e403252",
      "downloadsId": 1,
      "hash": "4a721222564bb3b9635f04efd12734622b1eb8ae",
      "lastModified": "2018-08-29T13:00:05+00:00",
      "time": "2016-08-17T12:48:57+00:00",
      "type": "snapshot",
      "url": "https://skyrising.github.io/mc-versions/manifest/4/a/721222564bb3b9635f04efd12734622b1eb8ae/16w33a.json"
    }
  ],
  "next": [
    "16w35a"
  ],
  "normalizedVersion": "1.11.0-alpha.16.33.a",
  "previous": [
    "16w32b"
  ],
  "protocol": {
    "type": "netty",
    "version": 303
  },
  "releaseTarget": "1.11",
  "releaseTime": "2016-08-17T12:48:57+00:00",
  "server": true,
  "sharedMappings": true,
  "world": {
    "format": "anvil",
    "version": 802
  }
}