{
  "$schema": "https://skyrising.github.io/mc-versions/schemas/version.json",
  "client": true,
  "downloads": {
    "client": {
      "sha1": "db2fcfdd23526b0f381ef2f3f2fd049d36227230",
      "size": 3981486,
      "url": "https://assets.minecraft.net/12w08a/minecraft.jar"
    },
    "server": {
      "sha1": "d0583dfd8466ea1368010d2a964e6ab0c0aaa0d1",
      "size": 1342476,
      "url": "https://assets.minecraft.net/12w08a/minecraft_server.jar"
    }
  },
  "id": "12w08a",
  "libraries": [
    "net.java.jinput:jinput-platform:2.0.5",
    "net.java.jinput:jinput:2.0.5",
    "net.java.jutils:jutils:1.0.0",
    "net.minecraft:launchwrapper:1.5",
    "net.sf.jopt-simple:jopt-simple:4.5",
    "org.lwjgl.lwjgl:lwjgl-platform:2.9.0",
    "org.lwjgl.lwjgl:lwjgl:2.9.0",
    "org.lwjgl.lwjgl:lwjgl_util:2.9.0",
    "org.ow2.asm:asm-all:4.1"
  ],
  "manifests": [
    {
      "assetHash": "4759bad2824e419da9db32861fcdc3a274336532",
      "assetIndex": "pre-1.6",
      "downloads": "49630142e1e5d9d627539048d7968d0b5e79cfad",
      "downloadsId": 1,
      "hash": "df49ac55f89ccb5b94c432ec4372c3384f091928",
      "time": "2012-02-23T15:12:46+00:00",
      "type": "snapshot",
      "url": "https://skyrising.github.io/mc-versions/manifest/d/f/49ac55f89ccb5b94c432ec4372c3384f091928/12w08a.json"
    }
  ],
  "next": [
    "1.2"
  ],
  "normalizedVersion": "1.2.0-alpha.12.8.a",
  "previous": [
    "12w07b"
  ],
  "protocol": {
    "type": "modern",
    "version": 28
  },
  "releaseTarget": "1.2",
  "releaseTime": "2012-02-23T15:12:46+00:00",
  "server": true,
  "sharedMappings": false,
  "world": {
    "format": "anvil"
  }
}