{
  "$schema": "https://skyrising.github.io/mc-versions/schemas/version.json",
  "client": true,
  "downloads": {
    "client": {
      "sha1": "4dedcb718a3382496d19d13cfe5dc070528a15cd",
      "size": 16016754,
      "url": "https://launcher.mojang.com/v1/objects/4dedcb718a3382496d19d13cfe5dc070528a15cd/client.jar"
    },
    "server": {
      "sha1": "ee66f5cb1247f4340734a151db4f940bbe04f833",
      "size": 32640589,
      "url": "https://launcher.mojang.com/v1/objects/ee66f5cb1247f4340734a151db4f940bbe04f833/server.jar"
    }
  },
  "id": "1.13-pre9",
  "libraries": [
    "com.google.code.gson:gson:2.8.0",
    "com.google.guava:guava:21.0",
    "com.ibm.icu:icu4j-core-mojang:51.2",
    "com.mojang:authlib:1.5.25",
    "com.mojang:brigadier:0.1.27",
    "com.mojang:datafixerupper:1.0.16",
    "com.mojang:patchy:1.3.9",
    "com.mojang:text2speech:1.10.3",
    "com.paulscode:codecjorbis:20101023",
    "com.paulscode:codecwav:20101023",
    "com.paulscode:libraryjavasound:20101123",
    "com.paulscode:soundsystem:20120107",
    "commons-codec:commons-codec:1.10",
    "commons-io:commons-io:2.5",
    "commons-logging:commons-logging:1.1.3",
    "io.netty:netty-all:4.1.25.Final",
    "it.unimi.dsi:fastutil:7.1.0",
    "net.java.dev.jna:jna:4.4.0",
    "net.java.dev.jna:platform:3.4.0",
    "net.java.jinput:jinput:2.0.5",
    "net.java.jutils:jutils:1.0.0",
    "net.sf.jopt-simple:jopt-simple:5.0.3",
    "org.apache.commons:commons-compress:1.8.1",
    "org.apache.commons:commons-lang3:3.5",
    "org.apache.httpcomponents:httpclient:4.3.3",
    "org.apache.httpcomponents:httpcore:4.3.2",
    "org.apache.logging.log4j:log4j-api:2.8.1",
    "org.apache.logging.log4j:log4j-core:2.8.1",
    "org.lwjgl:lwjgl-glfw:3.1.6",
    "org.lwjgl:lwjgl-jemalloc:3.1.6",
    "org.lwjgl:lwjgl-openal:3.1.6",
    "org.lwjgl:lwjgl-opengl:3.1.6",
    "org.lwjgl:lwjgl-stb:3.1.6",
    "org.lwjgl:lwjgl:3.1.6",
    "oshi-project:oshi-core:1.1"
  ],
  "manifests": [
    {
      "assetHash": "23981354446ddc141dcf03cc4bfa6b2a9492aa90",
      "assetIndex": "1.13",
      "downloads": "4e078b2a0d4f3adc0a76343952284df03e203461",
      "downloadsId": 1,
      "hash": "a345b4dd358f307c6c3654781fa6525930ec4b04",
      "lastModified": "2021-12-15T15:55:32+00:00",
      "time": "2018-07-16T14:17:42+00:00",
      "type": "snapshot",
      "url": "https://skyrising.github.io/mc-versions/manifest/a/3/45b4dd358f307c6c3654781fa6525930ec4b04/1.13-pre9.json"
    },
    {
      "assetHash": "23981354446ddc141dcf03cc4bfa6b2a9492aa90",
      "assetIndex": "1.13",
      "downloads": "4e078b2a0d4f3adc0a76343952284df03e203461",
      "downloadsId": 1,
      "hash": "46ee1ac597369b9ee177d80135d58073c7a0e2ea",
      "lastModified": "2021-12-10T03:01:37+00:00",
      "time": "2018-07-16T14:17:42+00:00",
      "type": "snapshot",
      "url": "https://skyrising.github.io/mc-versions/manifest/4/6/ee1ac597369b9ee177d80135d58073c7a0e2ea/1.13-pre9.json"
    },
    {
      "assetHash": "23981354446ddc141dcf03cc4bfa6b2a9492aa90",
      "assetIndex": "1.13",
      "downloads": "4e078b2a0d4f3adc0a76343952284df03e203461",
      "downloadsId": 1,
      "hash": "ed83da33e735ab2b523946de9f2b0b9f2db134af",
      "lastModified": "2021-07-07T13:59:12+00:00",
      "time": "2018-07-16T14:17:42+00:00",
      "type": "snapshot",
      "url": "https://skyrising.github.io/mc-versions/manifest/e/d/83da33e735ab2b523946de9f2b0b9f2db134af/1.13-pre9.json"
    },
    {
      "assetHash": "23981354446ddc141dcf03cc4bfa6b2a9492aa90",
      "assetIndex": "1.13",
      "downloads": "4e078b2a0d4f3adc0a76343952284df03e203461",
      "downloadsId": 1,
      "hash": "38e31e164059b22e9ef549f42ef596d334d3766d",
      "lastModified": "2018-08-29T12:58:46+00:00",
      "time": "2018-07-16T14:17:42+00:00",
      "type": "snapshot",
      "url": "https://skyrising.github.io/mc-versions/manifest/3/8/e31e164059b22e9ef549f42ef596d334d3766d/1.13-pre9.json"
    }
  ],
  "next": [
    "1.13-pre10"
  ],
  "normalizedVersion": "1.13.0-pre.9",
  "previous": [
    "1.13-pre8"
  ],
  "protocol": {
    "type": "netty",
    "version": 391
  },
  "releaseTarget": "1.13",
  "releaseTime": "2018-07-16T14:17:42+00:00",
  "server": true,
  "sharedMappings": true,
  "world": {
    "format": "anvil",
    "version": 1517
  }
}